{
  "schema_version": "material_balance_time_series.v1",
  "job_id": "job_material_balance_minimal",
  "job_type": "simulation.material_balance.v1",
  "timestamps": [0, 1],
  "node_data": {
    "n_reactor": {
      "label": "Reactor",
      "COD": [200, 180]
    }
  },
  "edge_data": {
    "e_in": {
      "source": "n_in",
      "target": "n_reactor",
      "flow_rate": [100, 100]
    }
  },
  "segment_markers": [],
  "parameter_change_events": []
}
